{
  "api_version": "proof.dev/workspace-authority-root/v1",
  "workspace_id": "019c0000-0000-7000-8000-000000000001",
  "authority_key_id": "ed25519:247b9ffc395d19a551889705a93c7cb466a4b5aea9e315f974b7b46dbe7f9453",
  "public_key": "JHuf/DldGaVRiJcFqTx8tGakta6p4xX5dLe0bb5/lFM=",
  "algorithm": "ed25519",
  "created_by_principal_id": "019c0000-0000-7000-8000-000000000002",
  "created_at": "2026-08-17T19:55:00Z",
  "predecessor_authority_key_id": null,
  "root_transition_envelope_digest": null
}
