{
  "api_version": "proof.dev/workspace-authority-root/v1",
  "workspace_id": "019c0000-0000-7000-8000-000000000001",
  "authority_key_id": "ed25519:c81f4ae33c9b631ed6ea507c1083eafd4b2b6cc89b5feaae4b5702c14591ea2e",
  "public_key": "yB9K4zybYx7W6lB8EIPq/UsrbMibX+quS1cCwUWR6i4=",
  "algorithm": "ed25519",
  "created_by_principal_id": "019c0000-0000-7000-8000-000000000002",
  "created_at": "2026-08-17T20:10:00Z",
  "predecessor_authority_key_id": "ed25519:247b9ffc395d19a551889705a93c7cb466a4b5aea9e315f974b7b46dbe7f9453",
  "root_transition_envelope_digest": "blake3:a04cdd5629f3db1a9fbddaf097ce86d68cbb53dd47e26ae5bd757f93e1afc045"
}
